{
  "schema_version": "1.0",
  "receipt_id": "prov-antigravity-0001",
  "platform": "antigravity",
  "session_id": "antigravity-session-0001",
  "run_id": "run-antigravity-0001",
  "worktree_identity": "worktree-cowok-0001",
  "observed_events": [{"event_type": "tool-call", "event_id": "evt-1", "redacted": true}],
  "observation_sha256": "bbbbbbbbbbbbbbbbbbbbbbbbbbbbbbbbbbbbbbbbbbbbbbbbbbbbbbbbbbbbbbbb",
  "signer_observer_separated": true
}
